dish_name,ingredients,recipe
Cheese pizza,"flour,yeast,water,salt,tomato sauce,mozzarella,basil","Mix dough ingredients, bake with sauce and cheese at 220C for 12 minutes"
Paneer Butter Masala,"paneer,butter,onion,tomato,cream,spices","Cook onions and tomatoes, add paneer and spices, finish with cream"
Vegetable Biryani,"rice,mixed vegetables,spices,yogurt,ghee,onion","Layer rice and vegetables, cook with spices, serve with raita"
Spaghetti Carbonara,"spaghetti,egg,parmesan,bacon,black pepper","Boil pasta, mix egg and cheese, combine with cooked bacon, toss together"
Tacos,"tortillas,ground beef,tomato,lettuce,cheese,sour cream","Cook beef, fill tortillas with meat and toppings, serve"

